{"$schema":"../schemas/model-routing.schema.json","cheap":{"model":"gpt-5.6-luna","reasoning":"low"},"coding":{"model":"gpt-5.6-terra","reasoning":"medium"},"difficult":{"model":"gpt-6-astra","reasoning":"high"},"exceptional":{"model":"gpt-6-astra","reasoning":"xhigh"},"unavailable":"inherit-parent","policy":"Recommendations only; verify model access and configure native agent TOML explicitly. JEV is a separate bounded judgment layer."}
